{
  "requestId": "sl-01a150af-794b-7aa8-ae89-482c5e38da65",
  "status": "READY",
  "candidates": [
    {
      "supplierId": "supplier-a",
      "displayName": "Supplier A",
      "rank": 1,
      "score": 90.82,
      "criteria": [
        {
          "criterion": "landed_cost",
          "weight": 25,
          "score": 100,
          "evidenceIds": []
        },
        {
          "criterion": "quality_evidence",
          "weight": 20,
          "score": 75,
          "evidenceIds": [
            "ev-supplier-a-1"
          ]
        },
        {
          "criterion": "trust_verification",
          "weight": 20,
          "score": 100,
          "evidenceIds": [
            "ev-supplier-a-3"
          ]
        },
        {
          "criterion": "lead_time",
          "weight": 10,
          "score": 84.78,
          "evidenceIds": []
        },
        {
          "criterion": "compliance",
          "weight": 10,
          "score": 75,
          "evidenceIds": [
            "ev-supplier-a-2"
          ]
        },
        {
          "criterion": "terms",
          "weight": 10,
          "score": 100,
          "evidenceIds": []
        },
        {
          "criterion": "communication",
          "weight": 5,
          "score": 97,
          "evidenceIds": []
        }
      ],
      "landedCost": {
        "cifMinor": "416874",
        "dutyMinor": "0",
        "sstMinor": "41687",
        "feesMinor": "0",
        "totalMinor": "458561",
        "fx": {
          "value": 0.61,
          "sourceUrl": "https://example.invalid/bnm/cny",
          "retrievedAt": "2026-10-16T02:00:00Z",
          "snippetHash": "0xd71f3489d71f3489d71f3489d71f3489d71f3489d71f3489d71f3489d71f3489",
          "evidence": "tier1",
          "sourceType": "mock"
        }
      },
      "payoutAccountHash": "0x321b1bc75ee23eb94bc426bcb45781111b67f273fd96d0aaee2ed23e511a7f13",
      "evidenceCoverageBps": 5000,
      "gates": [
        {
          "gate": "NO_ESCROW",
          "passed": true,
          "evidenceIds": []
        },
        {
          "gate": "PERSONAL_PAYEE",
          "passed": true,
          "evidenceIds": []
        },
        {
          "gate": "MISSING_CERT",
          "passed": true,
          "evidenceIds": [
            "ev-supplier-a-2"
          ]
        },
        {
          "gate": "OFF_PLATFORM_DISCOUNT",
          "passed": true,
          "evidenceIds": []
        },
        {
          "gate": "AI_INJECTION",
          "passed": true,
          "evidenceIds": []
        },
        {
          "gate": "OVER_MOQ",
          "passed": true,
          "evidenceIds": []
        },
        {
          "gate": "SANCTIONS",
          "passed": true,
          "evidenceIds": []
        }
      ],
      "redFlags": [],
      "pros": [
        {
          "text": "Strong landed cost: 100/100",
          "evidenceIds": []
        },
        {
          "text": "Strong trust and verification: 100/100",
          "evidenceIds": [
            "ev-supplier-a-3"
          ]
        }
      ],
      "cons": [],
      "whyNotNext": "Supplier B scores 34.45 points lower; biggest gap: quality evidence (75 vs 0).",
      "whatWouldChange": "No single score change moves Supplier B to #1; only new gate results or evidence would."
    },
    {
      "supplierId": "supplier-b",
      "displayName": "Supplier B",
      "rank": 2,
      "score": 56.37,
      "criteria": [
        {
          "criterion": "landed_cost",
          "weight": 25,
          "score": 100,
          "evidenceIds": []
        },
        {
          "criterion": "quality_evidence",
          "weight": 20,
          "score": 0,
          "evidenceIds": [
            "ev-supplier-b-4"
          ]
        },
        {
          "criterion": "trust_verification",
          "weight": 20,
          "score": 42,
          "evidenceIds": []
        },
        {
          "criterion": "lead_time",
          "weight": 10,
          "score": 84.78,
          "evidenceIds": []
        },
        {
          "criterion": "compliance",
          "weight": 10,
          "score": 0,
          "evidenceIds": []
        },
        {
          "criterion": "terms",
          "weight": 10,
          "score": 100,
          "evidenceIds": []
        },
        {
          "criterion": "communication",
          "weight": 5,
          "score": 90,
          "evidenceIds": []
        }
      ],
      "landedCost": {
        "cifMinor": "416874",
        "dutyMinor": "0",
        "sstMinor": "41687",
        "feesMinor": "0",
        "totalMinor": "458561",
        "fx": {
          "value": 0.61,
          "sourceUrl": "https://example.invalid/bnm/cny",
          "retrievedAt": "2026-10-16T02:00:00Z",
          "snippetHash": "0xd71f3489d71f3489d71f3489d71f3489d71f3489d71f3489d71f3489d71f3489",
          "evidence": "tier1",
          "sourceType": "mock"
        }
      },
      "payoutAccountHash": "0xab32e12b6efe1ad92f0c8772046bf316d34eabfcc900048de4923876c619a935",
      "evidenceCoverageBps": 0,
      "gates": [
        {
          "gate": "NO_ESCROW",
          "passed": true,
          "evidenceIds": []
        },
        {
          "gate": "PERSONAL_PAYEE",
          "passed": true,
          "evidenceIds": []
        },
        {
          "gate": "MISSING_CERT",
          "passed": true,
          "evidenceIds": []
        },
        {
          "gate": "OFF_PLATFORM_DISCOUNT",
          "passed": true,
          "evidenceIds": []
        },
        {
          "gate": "AI_INJECTION",
          "passed": true,
          "evidenceIds": []
        },
        {
          "gate": "OVER_MOQ",
          "passed": true,
          "evidenceIds": []
        },
        {
          "gate": "SANCTIONS",
          "passed": true,
          "evidenceIds": []
        }
      ],
      "redFlags": [
        {
          "text": "Unverified evidence ev-supplier-b-4 (tier 3): earns no score",
          "source": "https://example.invalid/evidence/supplier-b/4"
        }
      ],
      "pros": [
        {
          "text": "Strong landed cost: 100/100",
          "evidenceIds": []
        },
        {
          "text": "Strong terms: 100/100",
          "evidenceIds": []
        }
      ],
      "cons": [
        {
          "text": "Weak trust and verification: 42/100",
          "evidenceIds": []
        },
        {
          "text": "Weak quality evidence: 0/100",
          "evidenceIds": [
            "ev-supplier-b-4"
          ]
        }
      ],
      "whyNotNext": null,
      "whatWouldChange": "No single score change moves Supplier B above Supplier A; only new gate results or evidence would."
    }
  ],
  "excluded": [
    {
      "supplierId": "supplier-c",
      "gate": "AI_INJECTION"
    },
    {
      "supplierId": "supplier-d",
      "gate": "PERSONAL_PAYEE"
    },
    {
      "supplierId": "supplier-e",
      "gate": "OFF_PLATFORM_DISCOUNT"
    }
  ],
  "rankStabilityPct": 100,
  "shortlistHash": "0x7f9afcbbad082299c9906472a0672c9280bb2dbd0882074f4bece899ac5f8313",
  "weightsVersion": "w1",
  "failureReason": null
}